{
  "$schema": "./validate-only-runtime-consumption.schema.json",
  "schema_version": "lode.validate-only-runtime-consumption.v0",
  "truth_id": "lode.xhs-boss.write-precheck.runtime-consumption",
  "truth_version": "0.1.0",
  "asset_owner": "Lode",
  "consumer_boundary": {
    "allowed_consumers": [
      {
        "repository": "WebEnvoy/Harbor",
        "purpose": "provide current page, identity, session, resource, and evidence refs"
      },
      {
        "repository": "WebEnvoy/WebEnvoy",
        "purpose": "admit and record an exact validate-only precheck"
      }
    ],
    "admission_meaning": "Exact static admission truth only; consumers must independently prove current runtime facts and fail closed before any page interaction that can write or submit.",
    "runtime_execution": "out_of_scope",
    "live_success": "not_proven_by_lode"
  },
  "entries": [
    {
      "package_ref": "lode://site-capability/xiaohongshu/publish-note-precheck@0.1.0",
      "lock_ref": "lode://lock/site-capability/xiaohongshu/publish-note-precheck@0.1.2",
      "version": "0.1.0",
      "site_slug": "xiaohongshu",
      "capability_id": "publish-note-precheck",
      "operation_id": "xhs_publish_note_precheck",
      "operation_mode": "validate_only",
      "lifecycle": "proposed",
      "runtime_admission": {"enabled": true, "status": "current", "recheck_condition": "not_applicable"},
      "allowed_origins": [
        "https://www.xiaohongshu.com",
        "https://creator.xiaohongshu.com"
      ],
      "page_requirement": {
        "target_kind": "creator_publish_entrypoint",
        "required_page_fact": "snapshot.creator_publish_entrypoint.available",
        "required_visible_fields": [
          "upload_image_entry",
          "text_image_entry"
        ],
        "challenge_fact": "safety.challenge.absent",
        "page_change_policy": "reject"
      },
      "resource_requirements": {
        "path": "sites/xiaohongshu/publish-note-precheck/resource-requirements.json",
        "resource_requirements_id": "xiaohongshu.publish-note-precheck.resources",
        "resource_requirements_version": "0.1.0",
        "required_harbor_fact_keys": [
          "runtime.execution_surface.available",
          "runtime.public_https_navigation.allowed",
          "runtime.site_identity.logged_in",
          "snapshot.creator_publish_entrypoint.available",
          "refmap.entrypoint_refs.available",
          "evidence.snapshot_ref.available"
        ]
      },
      "freshness": {
        "policy": "current_execution_window",
        "applies_to": [
          "merged_head_ref",
          "page_ref",
          "identity_ref",
          "session_ref",
          "run_ref",
          "result_ref",
          "resource_refs",
          "field_source_refs",
          "evidence_refs",
          "post_check_ref",
          "submitted_result_ref"
        ],
        "stale_policy": "reject"
      },
      "field_sources": {
        "source_ref_policy": "summary_refs_only",
        "required_fields": {
          "upload_image_entry": [
            "creator_publish_page_summary",
            "dom_snapshot_summary"
          ],
          "text_image_entry": [
            "creator_publish_page_summary",
            "dom_snapshot_summary"
          ]
        },
        "missing_or_unreferenced_field_policy": "reject"
      },
      "failure_taxonomy": {
        "path": "sites/xiaohongshu/publish-note-precheck/failure-mapping.json",
        "failure_mapping_id": "xiaohongshu.publish-note-precheck.failure-mapping",
        "failure_mapping_version": "0.1.0",
        "required_classes": [
          "invalid_contract",
          "resource_unavailable",
          "site_changed",
          "empty_result",
          "preview_unavailable",
          "page_changed",
          "user_cancelled",
          "post_check_failed",
          "evidence_expired",
          "login_required",
          "permission_insufficient",
          "composition_not_initialized",
          "target_not_writable",
          "safety_challenge"
        ]
      },
      "evidence_and_post_check": {
        "evidence_ref_policy": "refs_only_no_inline_bodies",
        "required_ref_kinds": [
          "creator_publish_page_summary",
          "dom_snapshot_summary",
          "snapshot_ref",
          "post_check_ref"
        ],
        "post_check_path": "sites/xiaohongshu/publish-note-precheck/checks/post-check.json",
        "post_check_id": "xiaohongshu.publish-note-precheck.post-check",
        "post_check_version": "0.1.0",
        "required_post_check_fields": [
          "status",
          "reason",
          "source_refs",
          "evidence_refs",
          "submitted"
        ]
      },
      "runtime_result_requirements": {
        "required_refs": [
          "merged_head_ref",
          "identity_ref",
          "session_ref",
          "run_ref",
          "result_ref",
          "evidence_refs",
          "post_check_ref"
        ],
        "result_field": "submitted",
        "required_result_value": false
      },
      "safety_boundary": {
        "no_submit_guard": "active",
        "submitted": false,
        "submitted_must_remain_false": true,
        "blocked_external_actions": [
          "publish",
          "save",
          "upload",
          "submit",
          "schedule"
        ]
      },
      "lock_version": "0.1.2",
      "locked_asset_sha256": {
        "input_schema": "0bc840bb909128fa8243ddf4d56aa087a043b46fdfc780436b2c15a86a4d4e46",
        "normalized_output_schema": "335f2723efcedd83f22469bfd107d57e79ed9aebb6421e7438698cfbac405fff",
        "resource_requirements": "cbfe930c1a271221a1a9a51da80912a4f5c8fca19b7b0efa1d03ffee624db365",
        "version_lifecycle_metadata": "84c234770e15cffb5ceed0fb8a08c764307c5d294a012482e3d1200268ba0365",
        "write_deferred_guardrail": "dc1d901d9763557adcfca8d1fbd03b2a1a86bd151fe979e2f68e8dc7a1d17f77",
        "fixture": "1adfb60f27f974010d1f994db0e7f23d0c6daa940b3ecfb15c27cf81b6a56432",
        "core_consumption_fixture": "26af6d1fcd60fbc07c6ee619937a48f04737e402038a134c04a473dddfd49870",
        "post_check": "57aa3d23a6b76a4ae0c212977536666cdafbbf1331afca3f9fda7db60dbac183",
        "failure_mapping": "b423fb9195c70021d374f37e794352c0b4f7c872008e346bcb5505415d9333c4",
        "catalog_metadata": "94dc35bacdf839af130ee124131f9507bce01646e95a1b7559a12db9caa2c720",
        "composition_catalog": "b5a9d67b48efe63e6a09216a232ce697346c14a275a56f4f43d9df1fdda13b22",
        "repair_draft": "fb0423334add3e1556f844b2d56c171a3992cb1aa97a956a925b3ccfa2a2ab02",
        "overlay_fork_metadata": "660214d6f2d1359fc7acad75f65c68ccd4b3e8fa922b32309712ac36c44639bc"
      }
    },
    {
      "package_ref": "lode://site-capability/boss/greet-precheck@0.1.0",
      "lock_ref": "lode://lock/site-capability/boss/greet-precheck@0.1.1",
      "version": "0.1.0",
      "site_slug": "boss",
      "capability_id": "greet-precheck",
      "operation_id": "boss_greet_precheck",
      "operation_mode": "validate_only",
      "lifecycle": "proposed",
      "runtime_admission": {"enabled": false, "status": "deferred_experimental", "recheck_condition": "deferred_milestone_scope_restored_with_current_head_review_and_runtime_live_evidence"},
      "allowed_origins": [
        "https://www.zhipin.com"
      ],
      "page_requirement": {
        "target_kind": "job_or_recruiter_communication_target",
        "required_page_fact": "snapshot.job_or_recruiter_target.available",
        "required_visible_fields": [
          "job_target",
          "recruiter_target",
          "greet_editor",
          "send_control"
        ],
        "challenge_fact": "safety.challenge.absent",
        "page_change_policy": "reject"
      },
      "resource_requirements": {
        "path": "sites/boss/greet-precheck/resource-requirements.json",
        "resource_requirements_id": "boss.greet-precheck.resources",
        "resource_requirements_version": "0.1.0",
        "required_harbor_fact_keys": [
          "runtime.execution_surface.available",
          "runtime.public_https_navigation.allowed",
          "runtime.site_identity.logged_in",
          "snapshot.job_or_recruiter_target.available",
          "refmap.write_target_refs.available",
          "evidence.snapshot_ref.available"
        ]
      },
      "freshness": {
        "policy": "current_execution_window",
        "applies_to": [
          "merged_head_ref",
          "page_ref",
          "identity_ref",
          "session_ref",
          "run_ref",
          "result_ref",
          "resource_refs",
          "field_source_refs",
          "evidence_refs",
          "post_check_ref",
          "submitted_result_ref"
        ],
        "stale_policy": "reject"
      },
      "field_sources": {
        "source_ref_policy": "summary_refs_only",
        "required_fields": {
          "job_target": [
            "job_recruiter_target_summary",
            "dom_snapshot_summary"
          ],
          "recruiter_target": [
            "job_recruiter_target_summary",
            "dom_snapshot_summary"
          ],
          "greet_editor": [
            "job_recruiter_target_summary",
            "dom_snapshot_summary"
          ],
          "send_control": [
            "job_recruiter_target_summary",
            "dom_snapshot_summary"
          ]
        },
        "missing_or_unreferenced_field_policy": "reject"
      },
      "failure_taxonomy": {
        "path": "sites/boss/greet-precheck/failure-mapping.json",
        "failure_mapping_id": "boss.greet-precheck.failure-mapping",
        "failure_mapping_version": "0.1.0",
        "required_classes": [
          "invalid_contract",
          "resource_unavailable",
          "site_changed",
          "empty_result",
          "preview_unavailable",
          "page_changed",
          "user_cancelled",
          "post_check_failed",
          "evidence_expired",
          "login_required",
          "permission_insufficient",